{
  "name": "PaxaLabs",
  "description": "Paxa Labs is an AI research lab in Bangkok. Thai text to speech, translation into Thai, and Thai OCR are live today, with speech to text in research.",
  "urls": {
    "homepage": "https://paxalabs.com",
    "docs": "https://paxalabs.com/docs",
    "pricing": "https://paxalabs.com/pricing",
    "privacyPolicy": "https://paxalabs.com/privacy",
    "termsOfService": "https://paxalabs.com/terms",
    "console": "https://paxalabs.com/app"
  },
  "providerCountry": "TH",
  "category": "model_provider",
  "inferenceRegions": [
    "World"
  ]
}
