{
  "name": "KlingAI",
  "description": "Kling AI, tools for creating imaginative images and videos, based on state-of-art generative AI methods.",
  "urls": {
    "homepage": "https://klingai.com",
    "docs": "https://kling.ai/document-api/guides/get-started/overview",
    "pricing": "https://klingai.com/global/dev/pricing",
    "privacyPolicy": "https://klingai.com/privacy",
    "termsOfService": "https://klingai.com/terms"
  },
  "providerCountry": "CN",
  "category": "gateway_router",
  "inferenceRegions": [
    "World"
  ]
}
