{
  "name": "Fal",
  "description": "Easiest & most cost-effective way to use Gen AI. fal.ai is how devs integrate dozens of generative media models. FLUX, Kling, Hailuo +1000 more.",
  "icons": [
    {
      "src": "https://uxwing.com/wp-content/themes/uxwing/download/brands-and-social-media/fal-ai-icon.png"
    }
  ],
  "urls": {
    "homepage": "https://fal.ai",
    "docs": "https://docs.fal.ai",
    "pricing": "https://fal.ai/pricing",
    "privacyPolicy": "https://fal.ai/legal/privacy-policy",
    "termsOfService": "https://fal.ai/legal/terms-of-service"
  },
  "providerCountry": "US",
  "category": "gateway_router",
  "inferenceRegions": [
    "World"
  ]
}
