{
  "name": "AgDev",
  "description": "Build, test, and scale autonomous agents to automate any task — no code required.",
  "urls": {
    "homepage": "https://ag.dev",
    "docs": "https://docs.ag.dev",
    "pricing": "https://ag.dev/pricing",
    "privacyPolicy": "https://ag.dev/privacy",
    "termsOfService": "https://ag.dev/terms"
  },
  "providerCountry": "DE",
  "category": "app_tools",
  "inferenceRegions": [
    "World"
  ]
}
