{
  "name": "ShuttleAI",
  "description": "ShuttleAI provides a simple, scalable, and cost-effective solution for integrating AI models into your applications.",
  "urls": {
    "homepage": "https://shuttleai.com",
    "docs": "https://docs.shuttleai.com"
  },
  "providerCountry": "US",
  "category": "gateway_router",
  "inferenceRegions": [
    "World"
  ]
}
