{
  "name": "Connect0",
  "description": "connect0 gives every AI agent what a new hire gets on day one: an identity, a budget, a memory, and the business systems to do real work — every action audited, every dollar approved before it's spent, over OAuth 2.1 and MCP.",
  "urls": {
    "homepage": "https://connect0.ai",
    "pricing": "https://connect0.ai/pricing",
    "docs": "https://connect0.ai/docs",
    "privacyPolicy": "https://connect0.ai/privacy",
    "termsOfService": "https://connect0.ai/terms"
  },
  "providerCountry": "US",
  "category": "app_tools",
  "inferenceRegions": [
    "World"
  ]
}
