{
  "name": "camelAI",
  "description": "camelAI builds open-source AI products anyone can afford. camelRun hosts AI agents for $0.01 an agent-hour. camelCode is a coding agent with a permanent computer, free to start.",
  "urls": {
    "homepage": "https://camelai.com",
    "docs": "https://camelai.com/docs/camelrun/quickstart",
    "pricing": "https://camelai.com/pricing",
    "privacyPolicy": "https://camelai.com/privacy-policy",
    "termsOfService": "https://camelai.com/terms"
  },
  "providerCountry": "US",
  "category": "app_tools",
  "inferenceRegions": [
    "World"
  ]
}
