{
  "name": "VIABLELab",
  "description": "VIABLE Lab at University of Florida develops AI-powered educational technologies, learning analytics, and human-centered AI solutions for education. Led by Dr. Anthony Botelho.",
  "icons": [
    {
      "src": "https://www.viablelab.org/favicon.ico"
    }
  ],
  "urls": {
    "homepage": "https://www.viablelab.org",
    "docs": "https://developers.viablelab.org",
    "privacyPolicy": "https://www.viablelab.org/privacy-policy",
    "termsOfService": "https://www.viablelab.org/terms-of-service"
  },
  "providerCountry": "US",
  "category": "gateway_router",
  "inferenceRegions": [
    "World"
  ]
}
