{
  "name": "Radient",
  "description": "Radient is building the future of decentralized artificial general intelligence, making AGI accessible to everyone.",
  "icons": [
    {
      "src": "https://radienthq.com/favicon-192x192.png"
    }
  ],
  "urls": {
    "homepage": "https://radienthq.com",
    "docs": "https://docs.radienthq.com",
    "pricing": "https://radienthq.com/pricing",
    "privacyPolicy": "https://radienthq.com/privacy-policy",
    "termsOfService": "https://radienthq.com/terms"
  },
  "providerCountry": "CA",
  "category": "gateway_router",
  "inferenceRegions": [
    "World"
  ]
}
