{
  "name": "APIPASS",
  "description": "AI API marketplace: image generation, text processing, NLP & more. Easy integration, comprehensive documentation, reliable performance for developers.",
  "icons": [
    {
      "src": "https://encrypted-tbn0.gstatic.com/images?q=tbn:ANd9GcR1uKoVTju8Wz9liZXusAlDD7pRbIAQwD-RMDMCSVKUObrt-f--pYuW6xHg&s=10"
    }
  ],
  "urls": {
    "homepage": "https://apipass.dev",
    "docs": "https://apipass.dev/document",
    "pricing": "https://apipass.dev/app/pricing",
    "privacyPolicy": "https://apipass.dev/privacy",
    "termsOfService": "https://apipass.dev/terms"
  },
  "providerCountry": "SG",
  "category": "media_voice",
  "inferenceRegions": [
    "World"
  ]
}
