{
  "name": "MonsterGaming",
  "description": "AI-powered game development platform. Code generation, debugging, optimization, and asset pipelines — tuned for Unreal, Unity, Godot, and bespoke engines.",
  "urls": {
    "homepage": "https://monstergaming.ai",
    "docs": "https://monstergaming.ai/quickstart",
    "pricing": "https://monstergaming.ai/pricing",
    "privacyPolicy": "https://monstergaming.ai/privacy",
    "termsOfService": "https://monstergaming.ai/tos"
  },
  "providerCountry": "US",
  "category": "app_tools",
  "inferenceRegions": [
    "World"
  ]
}
