{
  "name": "NLPCloud",
  "description": "Advanced AI platform, for NER, sentiment analysis, emotion analysis, text classification, summarization, dialogue summarization, question answering, text generation, translation, language detection, grammar and spelling correction, intent classification, paraphrasing and rewriting, code generation, chatbot/conversational AI, automatic speech recognition api, speech to text, semantic similarity, semantic search, speech synthesis, Part-Of-Speech tagging, tokenization, lemmatization, and embeddings. Use the best AI engines without sacrificing data privacy.",
  "icons": [
    {
      "src": "https://nlpcloud.com/assets/images/logo.png"
    }
  ],
  "urls": {
    "homepage": "https://nlpcloud.com",
    "docs": "https://docs.nlpcloud.com",
    "pricing": "https://nlpcloud.com/pricing.html",
    "privacyPolicy": "https://nlpcloud.com/privacy.html",
    "termsOfService": "https://nlpcloud.com/tos.html"
  },
  "providerCountry": "FR",
  "category": "search_data",
  "inferenceRegions": [
    "World"
  ]
}
