{
  "name": "AIHubMix",
  "description": "Access every major LLM through a single, unified interface. Connect to ChatGPT, Claude, Gemini, DeepSeek, Doubao, Qwen and more with unlimited concurrency. Build smarter, faster.",
  "icons": [
    {
      "src": "https://raw.githubusercontent.com/lobehub/lobe-icons/refs/heads/master/packages/static-png/light/aihubmix-color.png"
    }
  ],
  "urls": {
    "homepage": "https://aihubmix.com",
    "docs": "https://docs.aihubmix.com",
    "pricing": "https://aihubmix.com/models",
    "termsOfService": "https://docs.aihubmix.com/cn/terms-of-use"
  },
  "providerCountry": "US",
  "category": "gateway_router",
  "inferenceRegions": [
    "World"
  ]
}
