{
  "name": "NousResearch",
  "description": "Nous Research is a leader in the American open source AI movement, training world-class open source language models.",
  "urls": {
    "homepage": "https://nousresearch.com",
    "docs": "https://portal.nousresearch.com/api-docs",
    "termsOfService": "https://portal.nousresearch.com/terms",
    "privacyPolicy": "https://portal.nousresearch.com/privacy",
    "console": "https://portal.nousresearch.com"
  },
  "providerCountry": "US",
  "category": "inference_compute",
  "inferenceRegions": [
    "World"
  ]
}
