{
  "name": "LLMkiwi",
  "description": "Build with LLM.kiwi using AI tools, a transparent model catalog, and an OpenAI-compatible API for production chat and automation workflows.",
  "icons": [
    {
      "src": "https://encrypted-tbn0.gstatic.com/images?q=tbn:ANd9GcRr8Sl-_UVZUl2_tGQXMZY4fFmBcGAmjtrFBg&s"
    }
  ],
  "urls": {
    "homepage": "https://llm.kiwi",
    "docs": "https://llm.kiwi/docs",
    "console": "https://llm.kiwi/dashboard",
    "pricing": "https://llm.kiwi/pricing",
    "privacyPolicy": "https://llm.kiwi/privacy-policy",
    "termsOfService": "https://llm.kiwi/terms-of-service"
  },
  "providerCountry": "HR",
  "category": "gateway_router",
  "inferenceRegions": [
    "World"
  ]
}
